{
  "$schema": "https://unemployment.dol.gov/schemas/identity-v1.0.json",
  "id": "19c05261-db64-4c78-ad54-4e1a75fdc508",
  "swa_xid": "35188697-18d5-44c0-bc59-0347930095c9",
  "claimant_id": "opaque-claimaint-string",
  "identity_provider": "login.gov",
  "identity_assurance_level": 2,
  "validated_at": "2022-02-26T14:47:02-06:00",
  "swa_code": "XX",
  "email": "someone@example.com",
  "all_emails": ["someone@example.net"],
  "birthdate": "2000-01-01",
  "ssn": "900-00-1234",
  "address": {
    "address1": "123 Any St",
    "city": "Somewhere",
    "state": "KS",
    "zipcode": "00000"
  },
  "phone": "555-555-1234",
  "verified_at": "2022-02-03T09:06:36-06:00"
}
